NO_MUNICIPIO;CO_MUNICIPIO;NO_ENTIDADE;CO_ENTIDADE;TP_LOCALIZACAO;TP_LOCALIZACAO_DIFERENCIADA;IN_ENERGIA_REDE_PUBLICA;IN_ENERGIA_GERADOR_FOSSIL;IN_ENERGIA_RENOVAVEL;IN_ENERGIA_INEXISTENTE;IN_ESGOTO_REDE_PUBLICA;IN_ESGOTO_FOSSA_SEPTICA;IN_ESGOTO_FOSSA_COMUM;IN_ESGOTO_INEXISTENTE;IN_LIXO_QUEIMA;IN_TRATAMENTO_LIXO_SEPARACAO;QT_MAT_BAS;QT_DOC_BAS;COORDENADAS_LAT;COORDENADAS_LON
Santa Cecília;4215505;CEI ARI ALVES DA SILVA;42117771;1;0;1;0;0;0;1;0;0;0;0;1;68;11;-26.95880519;-50.42603374
Santa Cecília;4215505;CEI LUIZ CARLOS ELY;42117780;1;0;1;0;0;0;1;0;0;0;0;1;78;16;-26.9697795;-50.4181464
Praia Grande;4213807;CEI PEQUENO APRENDIZ;42117801;1;0;1;0;0;0;1;0;0;0;0;1;75;7;-29.194336;-49.9259708
Porto União;4213609;NUCLEO DE EDUCACAO INFANTIL PINGO DE GENTE;42117828;1;0;1;0;0;0;1;0;0;0;0;1;88;13;-26.23637;-51.08120333
Florianópolis;4205407;NEIM LAUSIMAR MARIA LAUS;42117836;1;0;1;0;0;0;1;0;0;0;0;1;642;37;-27.4908854;-48.4120381
Florianópolis;4205407;NEIM JOAO MACHADO DA SILVA;42117844;1;0;1;0;0;0;1;0;0;0;0;1;85;9;-27.58028548;-48.54030181
Florianópolis;4205407;NEIM COLONIA Z 11;42117852;1;0;1;0;0;0;1;0;0;0;0;1;169;15;-27.57388023;-48.43086102
Florianópolis;4205407;NEIM ORISVALDINA DA SILVA;42117860;1;0;1;0;0;0;1;0;0;0;0;1;159;14;-27.5992247;-48.4707335
Florianópolis;4205407;NEIM IDALINA OCHOA;42117879;1;0;1;0;0;0;1;0;0;0;0;1;170;13;-27.6662128;-48.5366373
Barra Velha;4202107;CEI MADRE PAULINA;42117887;1;0;1;0;0;0;1;0;0;0;0;0;179;21;-26.6281599;-48.6879563
Turvo;4218806;CRECHE BAIRRO SAO CRISTOVAO;42117895;1;0;1;0;0;0;1;0;0;0;0;0;35;2;-28.93453435;-49.67151267
São João do Sul;4216404;CEI PARAISO DA CRIANCA;42117917;1;0;1;0;0;0;0;1;0;0;0;0;135;14;-29.22270561;-49.80676834
Ituporanga;4208500;CENTRO DE EDUCACAO INFANTIL DR MARIO CESAR SENS;42117941;1;0;1;0;0;0;1;0;0;0;0;1;84;10;-27.4179591;-49.5891208
Ituporanga;4208500;CENTRO DE EDUCACAO INFANTIL CECILIA KOPP THIESEN;42117950;1;0;1;0;0;0;1;0;0;0;0;1;43;7;-27.40590288;-49.59992808
Cocal do Sul;4204251;EEF CRISTO REI;42117968;1;0;1;0;0;0;1;0;0;0;0;1;514;31;-28.59042648;-49.32850781
Criciúma;4204608;EMEB ADOLFO BACK;42118000;1;0;1;0;0;0;1;0;0;0;0;1;473;35;-28.69503118;-49.42844777
Criciúma;4204608;EMEB ERICO NONNENMACHER;42118018;1;0;1;0;0;0;1;0;0;0;0;1;275;18;-28.69001164;-49.39983549
São Bento do Sul;4215802;CEIM CASTELO ENCANTADO;42118042;1;0;1;0;0;0;1;1;0;0;0;1;213;21;-26.22936412;-49.41652855
Laguna;4209409;CEI MICKEY MOUSE;42118115;2;0;1;0;0;0;0;0;1;0;0;1;74;6;-28.38396154;-48.78956655
Pescaria Brava;4212650;CEI PEIXINHO COLORIDO;42118140;2;0;1;0;0;0;0;1;0;0;0;0;42;5;-28.3733194;-48.917719
Massaranduba;4210605;PE BALAO MAGICO;42118158;1;0;1;0;0;0;0;0;1;0;0;0;40;3;-26.6239355;-49.0158928
Guaramirim;4206504;EMEF E PE VEREADOR ARMIN BYLAARDT;42118182;1;0;1;0;0;0;1;0;0;0;0;1;100;18;-26.469866;-49.0349376
Guaramirim;4206504;EMEF E PRE ESCOLA PROFESSOR ATILANO KRUGER;42118190;1;0;1;0;0;0;0;1;0;0;0;1;304;18;-26.479628;-48.9839629
Fraiburgo;4205506;COLEGIO CARLOS DRUMMOND DE ANDRADE;42118239;1;0;1;0;0;0;1;0;0;0;0;0;381;24;-27.02725697;-50.90913092
Barra Velha;4202107;CENTRO EDUCACIONAL CHICO BENTO;42118247;1;0;1;0;0;0;1;0;0;0;0;1;93;12;-26.632369;-48.6910086
Maravilha;4210506;DOM SISTEMA EDUCACIONAL;42118255;1;0;1;0;0;0;0;1;0;0;0;1;214;22;-26.767805;-53.17535333
Blumenau;4202404;CEI DANIEL BRESSANINI;42118280;1;0;1;0;0;0;1;0;0;0;0;0;153;22;-26.880676;-49.0456463
Fraiburgo;4205506;CEM ANTONIO PORTO BURDA;42118328;1;0;1;0;0;0;1;0;0;0;0;1;409;24;-27.05712167;-50.93865833
Florianópolis;4205407;NEIM DORALICE TEODORA BASTOS;42118336;1;0;1;0;0;0;1;0;0;0;0;1;333;22;-27.43373669;-48.45663719
Caçador;4203006;EMEB VEREDA DOS TREVOS;42118344;1;0;1;0;0;0;1;1;0;0;0;1;223;15;-26.79218167;-51.00304667
Chapecó;4204202;CENTRO EDUC APRENDER BRINCAR CRESCER;42118352;1;0;1;0;0;0;1;0;0;0;0;1;130;13;-27.09695;-52.61459
Campo Alegre;4203303;EMEB MARIA JOSE DUARTE SILVA BERNARDES;42118395;1;0;1;0;1;0;0;1;0;0;0;1;605;28;-26.19138977;-49.26371931
Otacílio Costa;4211751;CEI CATARINA FUHRMANN;42118409;1;0;1;0;0;0;1;0;0;0;0;1;118;17;-27.5062396;-50.1194243
Agrolândia;4200200;CENTRO DE EDUCACAO INFANTIL CANTINHO FELIZ;42118484;1;0;1;0;0;0;1;0;0;0;0;1;132;18;-27.41052016;-49.83012157
Ibirama;4206900;CENTRO DE EDUCACAO INFANTIL MOISES AMARAL;42118530;1;0;1;0;0;0;0;1;0;0;0;1;101;13;-27.10300603;-49.51891459
Braço do Norte;4202800;CENTRO EDUCACIONAL INFANTIL MAE JOAQUINA;42118565;2;0;1;0;0;0;0;0;1;0;0;1;76;4;-28.31939696;-49.08526577
Campos Novos;4203600;PRE ESCOLA MUNICIPAL A CAMINHO DO FUTURO;42118590;1;0;1;0;0;0;1;0;0;0;0;1;312;13;-27.39789183;-51.20840256
Campos Novos;4203600;CRECHE MUNICIPAL JUBILEU DE PRATA;42118611;1;0;1;0;0;0;1;0;0;0;0;1;97;7;-27.39293224;-51.21129933
Laurentino;4209508;CEI INFANCIA FELIZ;42118620;1;0;1;0;0;0;1;0;0;0;0;1;117;21;-27.2182891;-49.7304018
Lontras;4209904;CENTRO DE EDUCACAO INFANTIL TURMINHA PARAISO;42118662;1;0;1;0;0;0;1;0;0;0;0;1;83;10;-27.12625689;-49.53627057
São Bento do Sul;4215802;COLEGIO FROEBEL;42118670;1;0;1;0;0;0;1;1;0;0;0;1;636;42;-26.25103098;-49.3821916
São Miguel do Oeste;4217204;CEI PRIMEIROS PASSOS;42118719;1;0;1;0;0;0;0;1;0;0;0;1;101;9;-26.7383289;-53.5227216
São Miguel do Oeste;4217204;CEI CRIANCA FELIZ;42118735;1;0;1;0;0;0;0;1;0;0;0;0;135;12;-26.7272204;-53.5339943
Chapecó;4204202;CENTRO EDUCACIONAL CUIDADO DE MAE LTDA ME;42118743;1;0;1;0;0;0;1;0;0;0;0;1;73;3;;
São José;4216602;CENTRO EDUCACIONAL MARIA MONTESSORI;42118751;1;0;1;0;0;0;1;0;0;0;0;1;166;15;-27.59753;-48.6114
Imaruí;4207205;EEF PE ITAMAR LUIZ DA COSTA;42118778;2;0;1;0;0;0;0;1;0;0;0;0;78;12;;
Chapecó;4204202;CEIM PEQUENOS HEROIS;42118832;1;0;1;0;0;0;0;0;1;0;0;1;220;15;-27.09815607;-52.6705552
Chapecó;4204202;CEIM SAO PEDRO;42118840;1;0;1;0;0;0;1;0;0;0;0;1;253;20;-27.09567859;-52.58877872
Chapecó;4204202;CEIM CRIANCA E ESPERANCA;42118867;1;0;1;0;0;0;1;0;1;0;0;1;294;23;-27.09056914;-52.62943222
Chapecó;4204202;CEIM NOVA VIDA;42118875;2;0;1;0;0;0;0;0;1;0;0;1;119;11;-27.1882953;-52.6486306
Chapecó;4204202;CEIM BRINCAR E CRESCER;42118883;1;0;1;0;0;0;0;1;0;0;0;1;311;19;-27.0904239;-52.5981393
Chapecó;4204202;CEIM CIRANDA DO SABER;42118891;1;0;1;0;0;0;0;0;1;0;0;1;165;15;-27.107743;-52.62842871
Chapecó;4204202;CEIM IRIS ABELLO;42118905;1;0;1;0;0;0;0;0;1;0;0;1;156;13;-27.0995412;-52.6334353
Chapecó;4204202;CEIM BRINCAR E APRENDER;42118913;1;0;1;0;0;0;0;1;0;0;0;1;130;9;-27.1171412;-52.62304054
Chapecó;4204202;CEIM UNIVERSO DA CRIANCA;42118921;1;0;1;0;0;0;0;1;0;0;0;1;209;21;-27.07843613;-52.6301541
Presidente Getúlio;4214003;CENTRO DE EDUCACAO INFANTIL MUNICIPAL PETER PAN;42118956;2;0;1;0;0;0;0;1;0;0;0;1;13;4;-27.11555959;-49.77205171
Chapecó;4204202;EB MUN MARIA BORDIGNON DESTRI;42118964;1;0;1;0;0;0;0;0;1;0;0;1;440;40;-27.06467324;-52.63850866
Chapecó;4204202;EB MUN SAO CRISTOVAO;42118972;1;0;1;0;0;0;0;0;1;0;0;1;669;40;-27.0856578;-52.6306012
Chapecó;4204202;CEIB CENTRO DE EDUCACAO;42119057;1;0;1;0;0;0;1;0;0;0;0;1;202;17;;
Nova Trento;4211504;CRECHE MUNICIPAL CIRANDA CIRANDINHA;42119065;1;0;1;0;0;0;1;0;0;0;0;1;121;10;-27.29719195;-48.94746078
Grão-Pará;4206108;CEI TIO PATINHAS;42119073;1;0;1;0;0;0;1;0;0;0;0;1;242;19;-28.1854035;-49.2137062
Abelardo Luz;4200101;EBM 25 DE MAIO;42119103;2;1;1;0;0;0;0;0;1;0;1;0;230;16;-26.6608581;-52.1449321
Lages;4209300;EMEB NOSSA SENHORA DOS PRAZERES;42119111;1;0;1;0;0;0;1;0;0;0;0;1;379;18;-27.84116345;-50.34584356
Lages;4209300;EMEF DOM HONORATO PIAZZERA;42119154;2;0;1;0;0;0;0;0;1;0;1;1;5;1;-27.81286833;-50.34609667
Lages;4209300;EMEB IZIDORO MARIN;42119162;1;0;1;0;0;0;1;0;0;0;0;1;328;21;-27.80511086;-50.37808811
Ponte Alta do Norte;4213351;CEME GENTE PEQUENA;42119170;1;0;1;0;0;0;1;0;0;0;0;0;95;10;-27.1703921;-50.4643571
Timbó;4218202;NUCLEO DE EDUCACAO INFANTIL LUAR ENCANTADO;42119227;1;0;1;0;0;0;0;1;0;0;0;1;125;19;-26.84304672;-49.27728087
Timbó;4218202;NUCLEO DE EDUCACAO INFANTIL PARAISO DA CRIANCA;42119235;1;0;1;0;0;0;0;1;0;0;0;1;136;18;-26.81232826;-49.26567267
Timbó;4218202;UNIDADE PRE ESCOLAR HORTENSIA;42119243;1;0;1;0;0;0;0;1;0;0;0;1;25;8;-26.82557369;-49.31284348
Araranguá;4201406;CENTRO EDUCACIONAL EDUSU KIDS;42119294;1;0;1;0;0;0;1;0;0;0;0;0;100;8;-28.94519;-49.497125
Imaruí;4207205;EEF GUILHERMINA ANA PEREIRA;42119308;2;0;1;0;0;0;0;1;0;0;0;0;51;12;;
Xanxerê;4219507;CEMEI CANTINHO FELIZ;42119324;1;0;1;0;0;0;0;1;0;0;0;1;83;9;-26.8748597;-52.3979483
Xaxim;4219705;CEIM MARIO FERRAZZO;42119359;1;0;1;0;0;0;1;0;0;0;0;1;69;16;-26.9528951;-52.5232275
Imaruí;4207205;CEIM HERCULANO VICENTE LUIZ;42119383;2;0;1;0;0;0;0;1;0;0;0;0;95;9;-28.3445131;-48.815465
Jardinópolis;4208955;CEI VALMOR DOMINGOS ALBERTI;42119405;1;0;1;0;0;0;0;1;0;0;0;1;89;15;-26.72336017;-52.85936158
Itajaí;4208203;SERVICO NACIONAL DE APRENDIZAGEM COMERCIAL - SENAC DE ITAJAI;42119430;1;0;1;0;0;0;1;0;0;0;0;0;243;39;-26.91023;-48.66413333
Porto União;4213609;SERVICO NACIONAL DE APRENDIZAGEM COMERCIAL - SENAC PORTO UNIAO;42119448;1;0;1;0;0;0;1;0;0;0;0;1;203;26;-26.24156167;-51.0868
Rio do Sul;4214805;CEI NAVEGANTES;42119499;1;0;1;0;0;0;1;1;0;0;0;1;87;8;-27.1897231;-49.605076
Palhoça;4211900;EB PROFª ADRIANA WEINGARTNER;42119502;1;0;1;0;0;0;0;1;0;0;0;0;696;29;-27.64486384;-48.68727189
São José;4216602;FUND CATARINENSE DE ED ESPECIAL FCEE;42119510;1;0;1;0;0;0;1;0;0;0;0;1;;;-27.58249;-48.61586
São José;4216602;COLEGIO ALPHA OBJETIVO;42119529;1;0;1;0;0;0;1;0;0;0;0;1;422;36;-27.59767;-48.61022
Angelina;4200903;APAE - ANGELINA;42119545;1;0;1;0;0;0;1;0;0;0;0;1;;;-27.58340833;-48.98341333
Biguaçu;4202305;ESCOLA ESPECIAL LEANDRO DE AZEVEDO;42119553;1;0;1;0;0;0;1;0;0;0;0;0;;;-27.49587;-48.65406
Florianópolis;4205407;ASSOCIACAO CATARINENSE PARA INTEGRACAO DO CEGO - ACIC;42119588;1;0;1;0;0;0;1;0;0;0;0;1;;;-27.54759357;-48.49613649
Palhoça;4211900;APAE DE PALHOCA CAESP;42119600;1;0;1;0;0;0;1;0;0;0;0;0;;;-27.65572703;-48.66786361
Paulo Lopes;4212304;CAESP ALEXSANDRO VIRGILIO RAUPP;42119618;1;0;1;0;0;0;0;0;1;0;0;0;;;;
Santo Amaro da Imperatriz;4215703;CAESP SANTO AMARO DA IMPERATRIZ;42119626;1;0;1;0;0;0;1;0;0;0;0;0;;;-27.68739675;-48.77847642
Orleans;4211702;CAESP LAR DA ESPERANCA;42119677;1;0;1;0;0;0;1;0;0;0;0;0;;;-28.35482587;-49.29300944
Criciúma;4204608;CAESP CAMINHO DA LUZ CRICIUMA;42119707;1;0;1;0;0;0;1;0;0;0;0;1;;;-28.70136812;-49.39454114
Criciúma;4204608;IEE DIOMICIO FREITAS ASSOC PESTALOZZI DE CRICIUMA;42119715;1;0;1;0;1;0;1;0;0;0;0;1;;;-28.68336672;-49.37915926
Içara;4207007;CAESP SONHO DOURADO;42119723;1;0;1;0;1;0;1;0;0;0;0;0;;;-28.71992062;-49.29735071
Morro da Fumaça;4211207;CAESP MORRO DA FUMACA;42119740;1;0;1;0;0;0;1;0;0;0;0;1;;;-28.64889345;-49.20633741
Nova Veneza;4211603;CAESP ANGELICA DAL SASSO BORTOLUZZI;42119758;1;0;1;0;0;0;1;0;0;0;0;1;;;-28.64307572;-49.50392642
Siderópolis;4217600;CAESP DE SIDEROPOLIS - ESC ESPECIAL RENASCER;42119766;1;0;1;0;0;0;1;0;0;0;0;0;;;-28.59570982;-49.42516049
Urussanga;4219002;CAESP SANTA RITA DE CASSIA;42119774;1;0;1;0;0;0;1;0;0;0;0;0;;;-28.52403584;-49.32241025
Joinville;4209102;ASSOC JOINVILENSE INTEG DO DEF VISUAL;42119782;1;0;1;0;0;0;1;0;0;0;0;1;;;-26.34699;-48.85016
Joinville;4209102;ASSOC DE AMIGOS DO AUTISTA;42119790;1;0;1;0;0;0;1;0;0;0;0;1;;;-26.2648;-48.84924
Barra Velha;4202107;ESC ESPECIAL BRILHO DO SOL FLAVIO Q BORGES;42119804;1;0;1;0;0;0;1;0;0;0;0;0;;;-26.6510895;-48.6895762
Joinville;4209102;INST EDUC ESP PROFª LIA R S J DE SANTIS;42119812;1;0;1;0;0;0;1;0;0;0;0;1;;;-26.30482;-48.83244
Rio do Sul;4214805;ESC RECANTO ALEGRE;42119847;1;0;1;0;0;0;1;0;0;0;0;1;;;-27.21328581;-49.64591182
Presidente Getúlio;4214003;ESCOLA ESPECIAL FLOR DA ESPERANCA;42119855;1;0;1;0;0;0;1;0;0;0;0;0;;;-27.04782;-49.6188482
Taió;4217808;APAE DE TAIO;42119863;1;0;1;0;0;0;1;0;0;0;0;0;;;;
Trombudo Central;4218608;ESCOLA MISSAO DE AMOR;42119901;1;0;1;0;0;0;1;0;0;0;0;1;;;-27.2961201;-49.7857594
Anita Garibaldi;4201000;ESC ESPECIAL CANTINHO DOS SONHOS;42119928;1;0;1;0;0;0;1;0;1;0;0;1;;;-27.6909373;-51.1293269
Bom Jardim da Serra;4202503;APAE DE BOM JARDIM DA SERRA;42119936;1;0;1;0;0;0;1;0;0;0;0;1;;;;
Campo Belo do Sul;4203402;ESC ESPECIAL CANTINHO DO CEU;42119944;1;0;1;0;0;0;1;0;0;0;0;0;;;-27.9006177;-50.7590806
Curitibanos;4204806;ESCOLA ESPECIAL HUGO MIGUEL SULZBACH;42119952;1;0;1;0;0;0;0;1;0;0;0;1;;;-27.30009799;-50.58643964
Lages;4209300;ESCOLA DE SURDOS BEM ME QUER;42119960;1;0;1;0;0;0;1;0;0;0;0;1;;;-27.8226404;-50.3180248
São Joaquim;4216503;APAE DE SAO JOAQUIM;42119987;1;0;1;0;1;0;1;0;0;0;0;1;;;;
Urubici;4218905;ESC PE JOSE GONCALVES ESPINDOLA;42119995;1;0;1;0;0;0;1;0;0;0;0;1;;;-28.0120578;-49.5951144
Itaiópolis;4208104;CENTRO DE ATENDIMENTO EDUCACIONAL ESPECIALIZADO IRMA TEONILIA;42120004;1;0;1;0;1;0;0;0;1;0;0;1;;;-26.33112937;-49.90825244
Mafra;4210100;ESC ESPECIAL IRMA INES;42120012;1;0;1;0;0;0;0;1;0;0;0;1;;;-26.11802682;-49.79833506
Monte Castelo;4211108;ESC ESPECIAL NS APARECIDA;42120020;1;0;1;0;0;0;1;0;0;0;0;1;;;-26.45839;-50.23627667
Papanduva;4212205;ESCOLA ESPECIAL RAIO DE SOL - APAE DE PAPANDUVA;42120039;1;0;1;0;0;0;1;0;0;0;0;0;;;-26.41396292;-50.13695539
Capinzal;4203907;ESCOLA ESPECIAL WANDA MEYER;42120055;1;0;1;0;0;0;0;1;0;0;0;0;;;-27.342573;-51.6085184
Campos Novos;4203600;CAESP MENINO DEUS - APAE DE CAMPOS NOVOS;42120063;1;0;1;0;0;0;1;0;0;0;0;1;;;;
Joaçaba;4209003;CAESP - CENTRO DE ATENDIMENTO EDUCACIONAL ESPECIALIZADO- FREI BRUNO;42120071;1;0;1;0;0;0;1;0;0;0;0;1;;;-27.17933167;-51.51439833
Joaçaba;4209003;CAESP - CENTRO EDUCACIONAL ESPECIALIZADO EM EDUCACAO ESPECIAL - APAS;42120080;1;0;1;0;0;0;1;0;0;0;0;1;;;-27.17389266;-51.50404496
Concórdia;4204301;CENTRO DE ATENDIMENTO EDUCACIONAL ESPECIALIZADO - CAESP;42120101;1;0;1;0;0;0;0;1;0;0;0;1;;;-27.2203353;-52.0234088
Irani;4207809;ESCOLA ESP ARCO IRIS;42120110;1;0;1;0;0;0;1;0;0;0;0;1;;;;
Coronel Freitas;4204400;ESC ESPECIAL DE CORONEL FREITAS - APAE;42120152;1;0;1;0;0;0;0;1;0;0;0;1;;;-26.89964905;-52.70096975
Chapecó;4204202;APAE ESC RECANTO DA ESPERANCA;42120160;1;0;1;0;1;0;0;1;0;0;0;1;;;-27.12029483;-52.61420075
Modelo;4210902;CAESP ESPECIAL MUNDINHO FELIZ;42120179;1;0;1;0;0;0;0;1;0;0;1;0;;;-26.7806779;-53.05389707
Palmitos;4212106;ESCOLA ESPECIAL PROFª CELIA M S LUCCA;42120187;1;0;1;0;1;0;0;1;0;0;0;0;;;-27.07135667;-53.16266
Pinhalzinho;4212908;APAE DE PINHALZINHO-SC - CAESP PROFESSORA IVONE;42120195;1;0;1;0;1;0;0;1;0;0;0;1;;;-26.84373838;-52.98899963
Quilombo;4214201;CAESP PAULO FREIRE;42120209;1;0;1;0;0;0;0;1;0;0;0;1;;;-26.72045833;-52.71797833
São Carlos;4216008;ESC ESPECIAL PROFª MARCIA;42120217;1;0;1;0;0;0;1;1;0;0;0;1;;;-27.0765849;-53.004089
São Lourenço do Oeste;4216909;ESC ESPECIAL NS DAS GRACAS;42120225;1;0;1;0;1;0;1;0;0;0;0;1;;;-26.35755196;-52.8478886
Campo Erê;4203501;ESCOLA ESPECIAL CAMPO ERE;42120241;1;0;1;0;0;0;0;1;0;0;0;1;;;-26.3996042;-53.0895921
Cunha Porã;4204707;ESCOLA ESPECIAL RENASCER;42120250;1;0;1;0;0;0;1;0;0;0;0;1;;;-26.88892;-53.16296
Descanso;4204905;ESC ESPECIAL MAURICIO DALLA VECCHIA-CAESP-APAE DE DESCANSO;42120268;1;0;1;0;0;0;0;1;0;0;0;1;;;-26.81993357;-53.50935671
Guaraciaba;4206405;ESCOLA ESPECIAL SONHO MEU;42120276;1;0;1;0;0;0;1;0;0;0;0;0;;;-26.59945;-53.51745
Itapiranga;4208401;ESCOLA ESPECIAL IRENE SCHROEDER;42120292;1;0;1;0;0;0;1;0;0;0;0;1;;;;
Iporã do Oeste;4207650;ASSOCIACAO DE PAIS E AMIGOS DOS EXCEPCIONAIS APAE;42120306;1;0;1;0;0;0;1;0;0;0;0;1;;;-26.98958;-53.53608
Maravilha;4210506;CAESP MARISOL;42120314;1;0;1;0;0;0;0;1;0;0;0;1;;;-26.77116377;-53.18622842
São José do Cedro;4216701;CAESP VIVIANE;42120330;1;0;1;0;1;0;1;0;0;0;0;1;;;-26.4520203;-53.4951444
São Miguel do Oeste;4217204;ESC ESPECIAL CAMINHO ALTERNATIVO;42120349;1;0;1;0;1;0;0;1;0;0;0;1;;;;
São José;4216602;APAE DE SAO JOSE;42120357;1;0;1;0;0;0;1;0;0;0;0;1;;;-27.6167641;-48.6431233
Balneário Camboriú;4202008;ESCOLA ESPECIAL TEMPO FELIZ APAE;42120365;1;0;1;0;0;0;1;0;0;0;0;1;;;-26.99939;-48.64255
Camboriú;4203204;ESC ESPECIAL ALEGRIA DE VIVER;42120373;1;0;1;0;0;0;1;0;0;0;0;0;;;;
Navegantes;4211306;ESCOLA ESPECIAL DE NAVEGANTES;42120381;1;0;1;0;0;0;1;0;0;0;0;0;;;-26.89405;-48.65442
Itajaí;4208203;CAESP - WALDYR BENVENUTTI - APAE DE ITAJAI;42120390;1;0;1;0;0;0;1;0;0;0;0;1;;;-26.9125;-48.65846
Itajaí;4208203;INST DE FONOAUDIOLOGIA UNIVALI;42120403;1;0;1;0;0;0;1;0;0;0;0;0;;;;
Itajaí;4208203;CIEP VOVO BIQUINHA;42120411;1;0;1;0;0;0;1;0;0;0;0;1;;;-26.91339;-48.66364
Penha;4212502;CAESP HENNY COELHO - APAE DE PENHA;42120420;1;0;1;0;0;0;1;0;0;0;0;0;;;-26.78324;-48.63263
Balneário Piçarras;4212809;ESC ESPECIAL DEUS MENINO;42120438;1;0;1;0;0;0;1;0;0;0;0;0;;;-26.7744;-48.6774
Porto Belo;4213500;ESC ESPECIAL ENSINA ME A VIVER;42120446;1;0;1;0;0;0;0;1;0;0;0;1;;;-27.15329;-48.54001
Rio das Antas;4214409;EEB ESPECIAL MEU RECANTO;42120497;1;0;1;0;0;0;1;0;0;0;0;0;;;-26.89672937;-51.07419989
Santa Cecília;4215505;ESC ESP WALMOR ADELMO ELY;42120519;1;0;1;0;1;0;1;0;0;0;0;1;;;-26.96525272;-50.42246237
Videira;4219309;ESC ESPECIAL TIA ANA;42120527;1;0;1;0;0;0;1;0;0;0;0;1;;;-26.9964621;-51.1608443
Araranguá;4201406;ESCOLA ESPECIAL JOAO KRAES CAMPOS;42120535;1;0;1;0;0;0;1;0;0;0;0;1;;;-28.93040245;-49.47819924
Meleiro;4210803;ESC ESPECIAL DE MELEIRO;42120551;1;0;1;0;0;0;1;0;0;0;0;1;;;-28.82976416;-49.63409553
Santa Rosa do Sul;4215653;ESC ESPECIAL SANTA ROSA DO SUL;42120578;1;0;1;0;1;0;1;0;0;0;0;0;;;-29.13315;-49.70926
Sombrio;4217709;ESC ESPECIAL APAE;42120586;1;0;1;0;0;0;1;0;0;0;0;1;;;-29.10668117;-49.62403656
Timbé do Sul;4218103;APAE DE TIMBE DO SUL;42120594;1;0;1;0;0;0;1;1;0;0;0;0;;;-28.83029545;-49.8446884
Turvo;4218806;APAE DE TURVO;42120608;1;0;0;0;1;0;1;0;0;0;0;1;;;-28.9309871;-49.68088
Brusque;4202909;ASSOCIACAO DE PAIS E AMIGOS DOS EXCEPCIONAIS - INSTITUTO DE EDUCACAO SANTA INES E CLINICA UNIDUNITE;42120616;1;0;1;0;0;0;1;0;0;0;0;0;;;-27.1034412;-48.9256693
Canelinha;4203709;CAESP SANTANA;42120624;1;0;1;0;0;0;1;0;0;0;0;1;;;;
Guabiruba;4206306;ESCOLA ESPECIAL PROFESSOR ARTHUR WIPPEL;42120632;1;0;1;0;0;0;0;1;0;0;0;0;;;-27.07766837;-48.98990796
São João Batista;4216305;ESC ESPECIAL INST BENTA ALVES DE AZEVEDO;42120659;1;0;1;0;0;0;0;0;1;0;0;1;;;-27.27262285;-48.84360141
Xanxerê;4219507;ESC ESPECIAL HELENA ADAMS KELLER;42120713;1;0;1;0;0;0;1;0;0;0;0;1;;;-26.877062;-52.4167991
Xaxim;4219705;ESC ESPECIAL MARLENE STIEVEN- APAE DE XAXIM;42120721;1;0;1;0;0;0;1;1;0;0;0;1;;;-26.96063993;-52.54255083
Major Vieira;4210308;CAESP-CENTRO DE ATENDIMENTO EDUCACIONAL ESPECIALIZADO DE MAJOR VIEIRA;42120730;1;0;1;0;0;0;1;0;0;0;0;1;;;-26.36551333;-50.32454667
Garopaba;4205704;CAESP APAE RENASCER;42120772;1;0;1;0;0;0;0;1;0;0;0;1;;;;
Imaruí;4207205;CAESP ARCO IRIS;42120780;1;0;1;0;0;0;1;0;0;0;0;0;;;;
Laguna;4209409;ESC ESPECIAL SOLAR DA TERNURA;42120799;1;0;1;0;0;0;1;0;0;0;0;0;;;-28.48856;-48.77096
Rio Negrinho;4215000;APAE RIO NEGRINHO;42120829;1;0;1;0;0;0;1;0;0;0;0;0;;;-26.24077327;-49.50865115
São Bento do Sul;4215802;CAESP GIRASSOL;42120837;1;0;1;0;0;0;1;0;0;0;0;0;;;;
Blumenau;4202404;ESC ESPECIAL PROFª ESTELLA M CAROPRESO;42120853;1;0;1;0;0;0;1;0;0;0;0;1;;;-26.90097808;-49.09031656
Indaial;4207502;APAE DE INDAIAL;42120861;1;0;1;0;1;0;1;0;0;0;0;1;;;-26.897731;-49.2256782
Pomerode;4213203;CENTRO DE ATENDIMENTO EDUCACIONAL ESPECIALIZADO EGON KUHN;42120870;1;0;1;0;0;0;0;1;0;0;0;1;;;-26.71765103;-49.17384807
Gaspar;4205902;ASSOC DE PAIS E AMIGOS DOS EXCEPCIONAIS;42120888;1;0;1;0;0;0;0;1;0;0;0;1;;;-26.93708667;-48.93660833
Timbó;4218202;ESCOLA ESPECIAL INTEGRADA- CAESP DE TIMBO;42120900;1;0;1;0;0;0;1;1;0;0;0;1;;;-26.8102189;-49.2896251
Bom Retiro;4202602;ESCOLA ESPECIAL PADRE ADRIANO HOCH;42120926;1;0;1;0;0;0;1;0;0;0;0;0;;;-27.7937852;-49.4877938
Xanxerê;4219507;SESC ESCOLA;42120934;1;0;1;0;0;0;0;1;0;0;0;1;170;8;-26.8801994;-52.4121341
Canoinhas;4203808;CENTRO DE ATENDIMENTO ESPECIALIZADO SANTA CRUZ;42120942;1;0;1;0;0;0;0;1;0;0;0;1;;;;
Porto União;4213609;CAESP - CENTRO DE ATENDIMENTO EDUCACIONAL ESPECIALIZADO - APAE DE PORTO UNIAO;42120969;1;0;1;0;0;0;1;0;0;0;0;0;;;-26.23510667;-51.07917167
Porto União;4213609;APADAF;42120977;1;0;1;0;0;0;1;0;0;0;0;0;;;-26.23769711;-51.07927226
Rio do Campo;4214508;ESC ESPECIAL FLOR DO CAMPO;42120993;1;0;1;0;0;0;1;0;0;0;0;1;;;-26.95012348;-50.14006954
Schroeder;4217402;CEIM EZELIA CORREIA LOMBARDI;42121000;1;0;1;0;0;0;0;1;0;0;0;1;93;10;-26.4488499;-49.0229154
Cordilheira Alta;4204350;PROGRAMA ED ARTE ESPORTE E CIDADANIA;42121019;1;0;1;0;0;0;1;0;0;0;0;1;;;;
Pinhalzinho;4212908;SESI SC - PINHALZINHO;42121035;1;0;1;0;0;0;1;0;0;0;0;0;51;2;-26.84568116;-52.98568534
Agrolândia;4200200;CENTRO DE EDUCACAO COMPLEMENTAR EWALD BRUNO JULIUS KRESS;42121060;1;0;1;0;0;0;1;1;0;0;0;0;;;-27.4129683;-49.83398
Cocal do Sul;4204251;IEI PROF LENITA IZABEL DA SILVA;42121108;1;0;1;0;0;0;1;0;0;0;0;1;104;16;-28.59373175;-49.33325391
Pouso Redondo;4213708;CEI ANJO DA GUARDA;42121116;1;0;1;0;0;0;1;0;0;0;0;1;127;18;-27.25155703;-49.93417804
São Bernardino;4215752;CENTRO DE ATENDIMENTO ESPECIALIZADO SAO BERNARDINO;42121124;1;0;1;0;0;0;0;1;0;0;0;0;;;;
Ituporanga;4208500;ASSOCIACAO DAS IRMAS FRANCISCANAS DE SAO JOSE - ESCOLA TECNICA BOM JESUS;42121132;1;0;1;0;0;0;1;0;0;0;0;1;67;9;-27.41558167;-49.60037167
São José do Cedro;4216701;CRECHE MUNICIPAL SAO DOMINGOS;42121140;1;0;1;0;0;0;0;1;0;0;0;1;106;7;-26.44560556;-53.51007634
Braço do Norte;4202800;CEI ISAURA ULIANO SOMBRIO;42121159;1;0;1;0;0;0;1;0;0;0;0;1;229;9;-28.273652;-49.1435479
Itá;4208005;CRECHE MUNICIPAL ALECIR TREVISOL;42121167;1;0;1;0;1;0;1;0;0;0;0;0;118;2;-27.26891167;-52.35490333
São Bento do Sul;4215802;CEIM VERA LUCIA DRECHSLER KITZBERGER;42121175;1;0;1;0;0;0;1;0;0;0;0;1;112;10;-26.2098589;-49.4081043
São José;4216602;CENTRO EDUC CISNE BRANCO;42121183;1;0;1;0;0;0;1;0;0;0;0;0;64;5;;
Joinville;4209102;COLEGIO POSITIVO JOINVILLE;42121191;1;0;1;0;0;0;1;0;0;0;0;1;1187;67;-26.30508;-48.85743
Itajaí;4208203;CEI OMAR LUIZ MACAGNAN;42121205;1;0;1;0;0;0;0;0;1;0;0;1;160;14;-26.91551557;-48.69417818
Itajaí;4208203;CEDIN LUCY CANZIANI;42121213;1;0;1;0;0;0;1;0;0;0;0;1;;;-26.91213089;-48.68064866
Itajaí;4208203;CEI ANGELA DIAS RAMOS NEVES;42121221;1;0;1;0;0;0;0;1;0;0;0;1;188;14;-26.9024641;-48.6873772
Guaramirim;4206504;EMEF E PE QUATI;42121256;1;0;1;0;0;0;0;1;0;0;0;1;59;6;-26.4463787;-48.9078478
Três Barras;4218301;CENTRO EDUC RAIO DE SOL;42121329;1;0;1;0;0;0;0;1;0;0;0;1;85;10;-26.10773327;-50.32142708
Iporã do Oeste;4207650;CENTRO INTEGRADO DE ENSINO RURAL - CIER;42121345;2;0;1;0;0;0;0;1;0;0;0;1;85;13;-26.979615;-53.43837833
Indaial;4207502;EB PROFESSORA URSULA KROEGER;42121353;1;0;1;0;0;0;1;0;0;0;0;1;593;33;-26.88719593;-49.26115609
Jaraguá do Sul;4208906;EMEB RIBEIRAO MOLHA;42121361;1;0;1;0;0;0;1;0;0;0;0;1;188;19;-26.527035;-49.0753421
Indaial;4207502;EB MULDE BAIXA;42121370;1;0;1;0;0;0;0;1;0;0;0;1;175;20;-26.8493333;-49.2302124
Jaraguá do Sul;4208906;EMEB MAX SCHUBERT;42121388;1;0;1;0;0;0;1;0;0;0;0;0;636;32;-26.3641264;-49.1305212
Joinville;4209102;CENTRO EDUCACIONAL MAE NATUREZA;42121396;1;0;1;0;0;0;1;0;0;0;0;1;115;14;-26.32947;-48.83747
Capinzal;4203907;E M BERNARDO MORO SOBRINHO;42121400;1;0;1;0;0;0;1;0;0;0;0;1;445;26;-27.36031822;-51.60879093
Videira;4219309;COLEGIO SUPERACAO;42121442;1;0;1;0;0;0;1;0;0;0;0;0;396;32;-26.9917923;-51.1765164
Ponte Alta do Norte;4213351;CEME RECANTO DA CRIANCA;42121469;1;0;1;0;0;0;1;0;0;0;0;0;199;12;-27.16593065;-50.47266754
Araranguá;4201406;CEI TIA VALDA;42121574;1;0;1;0;0;0;0;1;0;0;0;0;199;13;-28.97390764;-49.52816806
Araranguá;4201406;CEI SAO JOSE;42121590;1;0;1;0;0;0;1;0;0;0;0;1;173;14;-28.9463178;-49.46452718
Araranguá;4201406;CEI LEDA DA SILVA MACHADO;42121604;1;0;1;0;0;0;1;0;0;0;0;0;110;15;-28.94475833;-49.487645
Tangará;4217907;CRECHE MUN JANE MARIA ARCARI FILIPPIN;42121612;1;0;1;0;0;0;0;1;0;0;0;0;146;14;-27.0975836;-51.2431213
São José do Cedro;4216701;CRECHE PINGO DE GENTE;42121655;1;0;1;0;0;0;0;1;0;0;0;1;156;14;-26.44543064;-53.50410819
Ilhota;4207106;CEI LARISSA MARINEIA MARTENDAL SCHWAMBACH;42121663;2;0;1;0;0;0;0;0;1;0;0;1;14;3;-26.82182683;-48.95533253
Agronômica;4200309;CEI BEATRIZ LOPES DA SILVA;42121671;1;0;1;0;0;0;1;1;0;0;0;1;92;11;-27.26510304;-49.71072149
Caçador;4203006;EEB WANDA KRIEGER GOMES;42121680;1;0;1;0;0;0;1;0;0;0;0;0;460;42;-26.79584352;-50.9881975
Videira;4219309;SESI SC - VIDEIRA;42121744;1;0;1;0;0;0;1;0;0;0;0;0;466;37;-27.01245667;-51.15294333
Bombinhas;4202453;EB MUN PEQUENO PRINCIPE;42121779;1;0;1;0;0;0;0;1;0;0;0;1;579;37;-27.15636;-48.50279
São Bento do Sul;4215802;EB MUN SOPHIA SCHWEDLER;42121787;1;0;1;0;0;0;1;0;0;0;0;1;346;19;-26.19670827;-49.39473595
Florianópolis;4205407;NEIM VICENTINA MARIA DA COSTA LAURINDO;42121795;1;0;1;0;0;0;0;1;0;0;0;1;124;10;-27.4674604;-48.4666803
Florianópolis;4205407;NEIM CAETANA MARCELINA DIAS;42121809;1;0;1;0;0;0;1;0;0;0;0;0;273;22;-27.70167864;-48.53625757
Florianópolis;4205407;NEIM FERMINIO FRANCISCO VIEIRA;42121817;1;0;1;0;0;0;1;1;0;0;0;0;307;30;-27.6030762;-48.5041939
Florianópolis;4205407;NEIM FRANCISCA IDALINA LOPES;42121825;1;0;1;0;0;0;0;1;0;0;0;0;145;19;-27.703252;-48.5059727
Florianópolis;4205407;NEIM MORRO DA QUEIMADA;42121833;1;0;1;0;0;0;1;0;0;0;0;1;91;19;-27.60976723;-48.5440388
Florianópolis;4205407;NEIM ALMIRANTE LUCAS ALEXANDRE BOITEUX;42121841;1;0;1;0;0;0;1;0;0;0;0;0;239;22;-27.5955584;-48.542804
Florianópolis;4205407;NEIM ARMACAO;42121850;1;0;1;0;0;0;0;1;0;0;0;0;231;17;-27.7525589;-48.5110833
Florianópolis;4205407;NEIM STELLA MARIS CORREA CARNEIRO;42121868;1;0;1;0;0;0;1;0;0;0;0;1;277;21;-27.397936;-48.4281639
Turvo;4218806;ESCOLA MUN SAO LUIZ;42121876;1;0;1;0;0;0;1;0;0;0;0;1;126;10;-28.92245104;-49.66374113
Rio do Sul;4214805;CE PROFESSORA DORES JANKE STUPP;42121892;1;0;1;0;0;0;1;1;0;0;0;1;267;21;-27.2333683;-49.6451647
Maracajá;4210407;ESCOLA DE EDUCACAO BASICA MUNICIPAL 12 DE MAIO;42121906;1;0;1;0;0;0;0;1;0;0;0;1;669;34;-28.85741682;-49.45402097
Blumenau;4202404;CEI DR ARAO REBELLO;42121922;1;0;1;0;0;0;1;0;0;0;0;1;201;32;-26.95219025;-49.13356085
Blumenau;4202404;CEI ROBERT RUDOLPH BARTH;42121930;1;0;1;0;0;0;1;0;0;0;0;1;209;29;-26.8536533;-49.1040719
Blumenau;4202404;CEI MAX SCHEIDEMANTEL;42121949;1;0;1;0;0;0;1;0;0;0;0;1;97;12;-26.88238564;-49.0728107
Joinville;4209102;ESCOLA MUNICIPAL PROFESSORA ELADIR SKIBINSKI;42121973;1;0;1;0;0;0;0;1;0;0;0;1;915;32;-26.24839;-48.79682
