NO_MUNICIPIO;CO_MUNICIPIO;NO_ENTIDADE;CO_ENTIDADE;TP_LOCALIZACAO;TP_LOCALIZACAO_DIFERENCIADA;IN_ENERGIA_REDE_PUBLICA;IN_ENERGIA_GERADOR_FOSSIL;IN_ENERGIA_RENOVAVEL;IN_ENERGIA_INEXISTENTE;IN_ESGOTO_REDE_PUBLICA;IN_ESGOTO_FOSSA_SEPTICA;IN_ESGOTO_FOSSA_COMUM;IN_ESGOTO_INEXISTENTE;IN_LIXO_QUEIMA;IN_TRATAMENTO_LIXO_SEPARACAO;QT_MAT_BAS;QT_DOC_BAS;COORDENADAS_LAT;COORDENADAS_LON
Joinville;4209102;ESCOLA MUNICIPAL PAULINE PARUCKER;42121981;1;0;1;0;0;0;1;0;0;0;0;1;1032;42;-26.3683;-48.82323
Concórdia;4204301;EBM ANNA ZAMARCHI COLDEBELLA;42121990;1;0;1;0;0;0;0;1;0;0;0;1;347;28;-27.19620833;-52.11199833
Presidente Getúlio;4214003;CENTRO DE EDUCACAO INFANTIL MUNICIPAL CANTINHO FELIZ;42122007;1;0;1;0;0;0;0;1;0;0;0;1;219;16;-27.03708354;-49.59851334
Presidente Getúlio;4214003;CENTRO DE EDUCACAO INFANTIL MUNICIPAL PINGO DE GENTE;42122015;1;0;1;0;0;0;0;1;0;0;0;1;184;13;-27.03384582;-49.636413
Presidente Getúlio;4214003;CENTRO DE EDUCACAO INFANTIL MUNICIPAL ADELINA CLARA HESS DE;42122023;1;0;1;0;0;0;0;0;1;0;0;1;323;26;-27.0566027;-49.62962265
Concórdia;4204301;EBM WALDEMAR PFEIFFER;42122031;1;0;1;0;0;0;0;1;0;0;0;1;541;39;-27.23343333;-52.04477
Urussanga;4219002;CENTRO EDUCACIONAL INFANTIL ELIAS BIZ;42122040;1;0;1;0;0;0;0;1;0;0;0;1;76;21;-28.51440809;-49.32000077
Romelândia;4215208;CRECHE PINGO DE GENTE;42122058;1;0;1;0;0;0;0;1;0;0;0;0;24;9;-26.66815259;-53.3172025
Petrolândia;4212700;CEI CANTINHO DE LUZ;42122066;1;0;1;0;0;0;1;0;0;0;0;0;43;8;-27.53530344;-49.69753428
Romelândia;4215208;CRECHE JEITINHO DE SER;42122074;1;0;1;0;0;0;0;1;0;0;0;0;60;15;-26.66831058;-53.31735758
Santa Terezinha;4215679;PRE ESCOLAR PEQUENO PRINCIPE;42122082;2;0;1;0;0;0;0;1;0;0;0;1;30;5;-26.7378405;-50.07848566
Balneário Camboriú;4202008;C E M ALFREDO DOMINGOS DA SILVA;42122139;1;0;1;0;0;0;1;0;0;0;0;1;501;20;-27.01633;-48.60256
Criciúma;4204608;EMEB MARIA ANGELICA PAULO;42122180;2;0;1;0;0;0;1;0;0;0;0;1;123;12;-28.720965;-49.36158167
Criciúma;4204608;EMEB JOSE ROSSO;42122198;2;0;1;0;0;0;0;1;0;0;0;1;471;27;-28.78402958;-49.36741408
Rio Negrinho;4215000;CMEI ARCO IRIS;42122260;1;0;1;0;0;0;1;0;0;0;0;1;69;14;-26.26509533;-49.51498845
Maravilha;4210506;CEI CINDERELA;42122309;1;0;1;0;0;0;0;1;0;0;0;1;100;10;-26.77400068;-53.17417808
São João do Oeste;4216255;CEI JESUS MENINO;42122317;1;0;1;0;0;0;0;1;0;0;0;1;99;8;-27.0992;-53.5913
Chapecó;4204202;CEIM PROJETO MINHA GENTE;42122325;1;0;1;0;0;0;0;0;1;0;0;1;309;20;-27.07725661;-52.63946524
Urussanga;4219002;ESC MUN PROF ERNESTO CESAR MARIOT;42122457;1;0;1;0;0;0;1;0;0;0;0;0;71;8;-28.53518054;-49.29478727
Joinville;4209102;ESCOLA MUNICIPAL PREFEITO JOAQUIM FELIX MOREIRA;42122538;1;0;1;0;0;0;1;0;0;0;0;1;812;29;-26.34392;-48.77281
Araquari;4201307;ESCOLA MUNICIPAL ROSALVO FERNANDES;42122546;1;3;1;0;0;0;1;0;0;0;0;0;798;26;;
Brusque;4202909;CEI PONTA RUSSA;42122554;1;0;1;0;0;0;1;0;0;0;0;0;120;8;-27.13866;-48.89142
Brusque;4202909;CEI LIMEIRA TIA ANA;42122562;1;0;1;0;0;0;1;0;0;0;0;1;275;18;-27.08467389;-48.85726971
Brusque;4202909;CEI RAIO DE SOL;42122570;1;0;1;0;0;0;1;0;0;0;0;1;216;20;-27.13195457;-48.91062093
Xanxerê;4219507;CEMEI NOVO HORIZONTE;42122600;1;0;1;0;0;0;0;1;0;0;0;1;68;7;-26.8865948;-52.3872455
Xanxerê;4219507;CEMEI FAVO DE MEL;42122619;1;0;1;0;0;0;0;1;0;0;0;1;61;6;-26.8873903;-52.4103691
Xanxerê;4219507;CEMEI PINGO DE GENTE;42122627;1;0;1;0;0;0;0;1;0;0;0;1;47;7;-26.8716;-52.4119473
Correia Pinto;4204558;ESCOLA ITINERANTE PROFESSORA ANA MARIA RODRIGUES COELHO;42122635;2;0;1;0;0;0;0;1;0;0;0;1;59;11;-27.58831376;-50.36838776
Riqueza;4215075;CENTRO EDUCACIONAL NEDYR SPEZZATTO;42122651;2;0;1;0;0;0;0;1;0;0;0;1;125;13;-26.99603;-53.34411
Brunópolis;4202875;CENTRO DE EDUCACAO INFANTIL SOSSEGO DA MAMAE;42122660;2;0;1;0;0;0;0;1;0;0;0;0;41;5;-27.3313163;-50.7663281
Campos Novos;4203600;CEIM MENINO JESUS;42122686;2;0;1;0;0;0;0;1;0;0;0;1;31;4;;
Brunópolis;4202875;CRECHE MUNICIPAL CRIANCA FELIZ;42122694;1;0;1;0;0;0;1;0;0;0;0;1;77;11;-27.3117591;-50.8379445
Descanso;4204905;CENTRO DE EDUCACAO INFANTIL E ENSINO FUNDAMENTAL GETULIO VARGAS;42122716;1;0;1;0;0;0;1;0;0;0;0;1;251;18;-26.8304839;-53.5039068
Chapecó;4204202;CEIM CIRANDA DA CRIANCA;42122724;1;0;1;0;0;0;0;0;1;0;0;1;761;37;-27.09815833;-52.68550802
Chapecó;4204202;EB MUN JARDIM DO LAGO;42122732;1;0;1;0;0;0;0;1;0;0;0;1;1210;77;-27.0981345;-52.68648224
Chapecó;4204202;ESCOLA PARQUE CIDADA LEONEL DE MOURA BRIZOLA;42122740;1;0;1;0;0;0;0;1;0;0;0;1;351;31;-27.1010498;-52.592824
Monte Carlo;4211058;EEBM SONHO INFANTIL;42122759;1;0;1;0;0;0;1;0;0;0;0;0;377;15;-27.2153982;-50.9791213
Campo Alegre;4203303;CMEI CHAPEUZINHO VERMELHO;42122775;1;0;1;0;0;0;0;1;0;0;0;1;126;15;-26.0905123;-49.25824342
Matos Costa;4210704;CEI MUN SEMENTINHA DO SABER;42122791;1;0;1;0;0;0;1;0;0;0;0;1;50;7;-26.4703946;-51.1507597
Xanxerê;4219507;CEMEI CARROSSEL;42122813;1;0;1;0;0;0;0;1;0;0;0;1;98;8;-26.884494;-52.3872351
Criciúma;4204608;EMEB ANGELO DE LUCA;42122821;2;0;1;0;0;0;0;1;0;0;0;1;346;25;-28.73001559;-49.37606459
Criciúma;4204608;EMEB PE CARLOS WECKI;42122830;1;0;1;0;0;0;1;0;0;0;0;1;337;24;-28.69113011;-49.42227511
Criciúma;4204608;EMEB PE PAULO PETRUZZELLIS;42122848;1;0;1;0;0;0;1;0;0;0;0;1;810;47;-28.69920399;-49.39844574
Ascurra;4201703;CEI PROFESSORA ONORATA ZONTA DALFOVO;42122856;1;0;1;0;0;0;0;1;0;0;0;1;130;12;-26.9597807;-49.37812136
São Joaquim;4216503;EBM ATTILIA CECHINEL NEZI;42122864;2;0;1;0;0;0;0;1;0;0;0;1;121;15;-28.2948242;-49.9331512
São Bento do Sul;4215802;CEI MUN SONHO MEU;42122899;1;0;1;0;0;0;1;0;0;0;0;1;138;13;-26.2044651;-49.3938727
São José;4216602;ACAO SOCIAL SALTO DO MAROIM CEI FREI ANTONIO;42122902;1;0;1;0;0;0;1;1;0;0;0;1;193;8;-27.58528606;-48.71541375
Massaranduba;4210605;CEI MUNDO INFANTIL;42122910;1;0;1;0;0;0;0;0;1;0;0;0;104;12;-26.6135945;-49.0065136
Governador Celso Ramos;4206009;CEI PROFª LUCIA FRANCISCA SAGAS;42122937;1;0;1;0;0;0;0;1;0;0;0;1;142;16;;
Governador Celso Ramos;4206009;CEI PROFª DULCE GODINHO NAZARIO;42122945;1;0;1;0;0;0;0;1;0;0;0;0;82;8;-27.31657695;-48.5732959
Governador Celso Ramos;4206009;CEI PROF ROBERTO MANOEL CALLADO;42122953;1;0;1;0;0;0;0;1;0;0;0;0;148;12;-27.36669734;-48.55889206
Governador Celso Ramos;4206009;CEI MUN JULIA SAGAS;42122961;1;0;1;0;0;0;0;1;0;0;0;0;132;10;-27.33332079;-48.54557218
Videira;4219309;CENTRO MUNICIPAL DE EDUCACAO INFANTIL AMELIA ZANESCO PERETTI;42122996;1;0;1;0;0;0;0;1;0;0;0;0;145;10;-27.02406844;-51.15051106
Entre Rios;4205175;ESCOLA MUNICIPAL SANTA LUCIA;42123003;1;0;1;0;0;0;1;0;0;0;0;1;162;12;-26.7219268;-52.5645486
Guaramirim;4206504;CENTRO EDUCACIONAL MUNICIPAL PROFESSOR GUSTAVO TANK;42123020;1;0;1;0;0;0;1;1;0;0;0;1;233;15;-26.4591143;-49.0238103
Nova Itaberaba;4211454;EM SONHO INFANTIL;42123062;1;0;1;0;0;0;0;1;0;0;0;1;73;9;-26.939893;-52.8126424
Apiúna;4201257;EB SUBIDA;42123127;2;0;1;0;0;0;0;1;0;0;0;1;273;16;-27.10412333;-49.457515
Guabiruba;4206306;ESCOLA BASICA MUNICIPAL PADRE GERMANO BRANDT;42123135;1;0;1;0;0;0;1;1;0;0;0;1;348;22;-27.08440115;-49.01825455
Pomerode;4213203;EEBM PROF VIDAL FERREIRA;42123143;1;0;1;0;0;0;0;1;0;0;0;1;239;20;-26.7213094;-49.2038952
Concórdia;4204301;EBM CONCORDIA - CAIC;42123208;1;0;1;0;0;0;0;1;0;0;0;1;560;43;-27.23615455;-52.04141532
Tubarão;4218707;CEI FELICIANA CORREA DA SILVA;42123267;1;0;1;0;0;0;0;1;0;0;0;0;82;13;-28.4311563;-49.0172317
Itajaí;4208203;CENTRO EDUC PRE ESCOLAR ARTE BABY LTDA;42123283;1;0;1;0;0;0;1;0;0;0;0;1;39;5;-26.90381;-48.65868
Blumenau;4202404;COLEGIO CASTELO EIRELI EPP;42123291;1;0;1;0;0;0;1;0;0;0;0;1;695;39;-26.9256874;-49.121919
Biguaçu;4202305;EIEF KAAKUPE;42123313;2;2;1;0;0;0;0;1;0;0;0;0;53;8;;
Itajaí;4208203;COLEGIO CRISTAO AMAR;42123364;1;0;1;0;0;0;1;0;0;0;0;1;453;30;-26.91125;-48.68924
Itapema;4208302;COLEGIO UNIFICADO;42123372;1;0;1;0;0;0;1;0;0;0;0;1;584;24;-27.14358;-48.59627
Ibiam;4206751;CEI MUN JOSE ATILIO GRASSI;42123380;1;0;1;0;0;0;0;1;0;0;0;0;63;5;-27.178274;-51.2363815
Mafra;4210100;CEIM VILA NOVA;42123410;1;0;1;0;0;0;0;1;0;0;0;1;152;12;-26.14155833;-49.83124932
Balneário Barra do Sul;4202057;EM ADALZIZA LEONIDA DE SOUZA CUNHA;42123445;1;0;1;0;0;0;0;0;1;0;0;1;224;9;-26.4574046;-48.5982105
Criciúma;4204608;CEI AFASC URDA JOANA JOAQUIM;42123496;1;0;1;0;0;0;1;1;0;0;0;1;173;25;-28.69540208;-49.4285273
Criciúma;4204608;CEI AFASC MORADAS DA COLINA;42123500;1;0;1;0;0;0;1;1;0;0;0;1;76;11;-28.66585387;-49.39618981
São Ludgero;4217006;PE BOM RETIRO;42123550;2;0;1;0;0;0;0;1;0;0;0;1;18;1;-28.3554032;-49.1249229
Jaraguá do Sul;4208906;EMEB ATAYDE MACHADO;42123577;1;0;1;0;0;0;1;0;0;0;0;1;269;21;-26.47193543;-49.08073425
Itajaí;4208203;EB PEDRO PAULO REBELLO;42123585;1;0;1;0;0;0;1;0;0;0;0;1;819;39;-26.9118279;-48.698028
Sul Brasil;4217758;CMEI APRENDER BRINCANDO;42123593;1;0;1;0;0;0;1;0;0;0;0;1;125;12;-26.73862626;-52.96188651
Serra Alta;4217550;CEI PRIMEIROS PASSOS;42123607;1;0;1;0;0;0;0;1;0;0;0;1;116;18;-26.7320707;-53.0427023
Canoinhas;4203808;GEM PROFESSORA XEILA ELISABETE CORNELSEN;42123615;1;0;1;0;0;0;0;1;0;0;0;1;150;7;-26.18115667;-50.36609667
Joinville;4209102;ESCOLA NOVA GERACAO;42123631;1;0;1;0;0;0;1;0;0;0;0;1;167;16;-26.3241304;-48.8406937
Porto União;4213609;PATRICIA ELAINE KREUZBERG SILVA E CIA LTDA - ME;42123640;1;0;1;0;0;0;1;0;0;0;0;1;304;25;-26.23700839;-51.08416968
Itajaí;4208203;EB PROF MARIA ROSA HELENO SCHULTE;42123658;1;0;1;0;0;0;0;1;0;0;0;1;672;36;-26.8978258;-48.7389861
Caçador;4203006;EMEB TABAJARA;42123666;1;0;1;0;0;0;1;1;0;0;0;1;446;30;-26.7612117;-51.0194818
Laguna;4209409;CEI PADRE AUGUSTINHO;42123674;1;0;1;0;0;0;1;0;0;0;0;1;188;24;-28.46873799;-48.78284921
Criciúma;4204608;COLEGIO UNIVERSITARIO CRICIUMA LTDA;42123682;1;0;1;0;0;0;1;0;0;0;0;0;257;25;-28.68186957;-49.37398763
São Ludgero;4217006;COLEGIO EVOLUCAO;42123704;1;0;0;0;1;0;1;0;0;0;0;0;522;27;;
Salete;4215307;CENTRO EDUCACIONAL PREFEITO AFFONSO ROHDEN;42123747;1;0;1;0;0;0;0;1;0;0;0;0;146;14;-26.978075;-49.99351
Lages;4209300;COLEGIO OBJETIVO LAGES UNIDADE II;42123755;1;0;1;0;0;0;1;0;0;0;0;1;278;19;-27.81079195;-50.31091031
Palhoça;4211900;CETK - CENTRO DE EDUCACAO TEREZINHA KRAUTZ;42123763;1;0;1;0;0;0;0;1;0;0;0;0;354;22;;
Braço do Norte;4202800;CEI ADRIANA APARECIDA VIANA;42123810;1;0;1;0;0;0;1;0;0;0;0;1;154;7;-28.27775813;-49.16273911
Fraiburgo;4205506;EEF BAIRRO DAS NACOES;42123844;1;0;1;0;0;0;1;1;0;0;0;1;516;33;-27.02996167;-50.90695667
Cocal do Sul;4204251;IEI HELENA SAVI;42123852;1;0;1;0;0;0;1;0;0;0;0;1;54;10;-28.60361;-49.31389209
Araranguá;4201406;CEI GENTE INOCENTE;42123879;1;0;1;0;0;0;0;1;0;0;0;0;138;11;-28.96099124;-49.49884051
Imbuia;4207403;ESCOLA BASICA MUNICIPAL PROFESSORA UMBELINA LORENZI;42123909;1;0;1;0;0;0;1;0;0;0;0;1;439;23;-27.4990035;-49.4251517
São Bento do Sul;4215802;CEI MUN TRENZINHO MALUCO;42123941;1;0;1;0;0;0;1;0;0;0;0;1;87;11;-26.2695485;-49.3721204
Santo Amaro da Imperatriz;4215703;EB MUN PREF AUGUSTO ALTHOFF;42123950;1;0;1;0;0;0;0;1;0;0;0;1;235;25;-27.70845767;-48.80218813
Itajaí;4208203;CEI PROF MANOEL FERREIRA DE MIRANDA;42123968;1;0;1;0;0;0;0;1;0;0;0;1;90;10;-26.871399;-48.698861
Guabiruba;4206306;ESCOLA BASICA MUNICIPAL PROF CARLOS MAFFEZZOLLI;42123976;1;0;1;0;0;0;0;1;0;0;0;1;492;18;-27.06950698;-48.97257318
Águas Frias;4200556;CENTRO MUN ED INFANTIL AQUARELA;42123984;1;0;1;0;0;0;0;1;0;0;0;1;151;11;-26.8809693;-52.8656444
São Francisco do Sul;4216206;EB MUN ALVARO TANCREDO DIPPOLD;42123992;1;0;1;0;0;0;1;0;0;0;0;1;306;18;-26.25925098;-48.62101362
Fraiburgo;4205506;CEI BELA VISTA;42124034;1;0;1;0;0;0;1;1;0;0;0;1;160;16;-27.02563833;-50.93058833
Maravilha;4210506;CENTRO EDUC VER RAYMUNDO VEIT;42124131;1;0;1;0;0;0;0;1;0;0;0;1;574;34;-26.76202333;-53.17911833
Maravilha;4210506;CENTRO EDUC MONTEIRO LOBATO;42124140;1;0;1;0;0;0;0;1;0;0;0;1;220;21;-26.7671734;-53.1645174
Nova Erechim;4211405;ESCOLA REUNIDA MUNICIPAL PROFª LYDIA FRANZON DONDONI;42124166;1;0;1;0;0;0;0;1;0;0;0;1;322;15;-26.902441;-52.9025011
Videira;4219309;ESCOLA DE EDUCACAO BASICA MUNICIPAL CRIANCA DO FUTURO CAIC;42124212;1;0;1;0;0;0;0;1;0;0;0;0;685;26;-27.0245535;-51.1435682
Itajaí;4208203;CEDIN VERDE VALE;42124263;1;0;1;0;0;0;1;0;0;0;0;1;;;-26.9282023;-48.649394
Itajaí;4208203;CEDIN JACY DIAS RAMOS;42124271;1;0;1;0;0;0;1;0;0;0;0;1;;;-26.8880869;-48.6953105
Timbó;4218202;NUCLEO DE EDUCACAO INFANTIL PRIMEIROS PASSOS;42124280;1;0;1;0;0;0;0;1;0;0;0;1;168;17;-26.82237667;-49.25679
União do Oeste;4218855;ESCOLA REUNIDA MUNICIPAL ANGELO SOLETTI;42124352;1;0;1;0;0;0;0;1;0;0;0;1;182;14;-26.7622962;-52.8578694
Papanduva;4212205;PE CANTINHO DA ALEGRIA;42124360;1;0;1;0;0;0;0;0;1;0;0;0;187;10;-26.41129886;-50.14318071
Rio Negrinho;4215000;EMEB PREF HENRIQUE LIEBL;42124379;1;0;1;0;0;0;1;0;0;0;0;1;489;22;-26.24815673;-49.5339338
Araranguá;4201406;EB MUN JOAO MATIAS;42124387;1;0;1;0;0;0;1;0;0;0;0;0;480;24;-28.93220626;-49.46884635
Guaraciaba;4206405;CEIM PRIMEIROS PASSOS;42124433;1;0;1;0;0;0;1;0;0;0;0;1;175;9;-26.60131266;-53.52378908
Joinville;4209102;CAIC PROFESSOR MARIANO COSTA;42124450;1;0;1;0;0;0;1;0;0;0;0;1;1117;37;-26.3157;-48.8032
Joinville;4209102;CAICPROF DESEMB FRANCISCO JOSE R DE OLIVEIRA;42124468;1;0;1;0;0;0;1;0;0;0;0;1;752;34;;
Joinville;4209102;E M PROFESSOR SAUL SANTANNA DE OLIVEIRA DIAS;42124476;1;0;1;0;0;0;1;0;0;0;0;1;577;24;-26.3447;-48.80386
Balneário Camboriú;4202008;CEM ARIRIBA;42124514;1;0;1;0;0;0;1;0;0;0;0;1;1014;38;-26.9728647;-48.6436625
Balneário Camboriú;4202008;C E M JARDIM IATE CLUBE;42124522;1;0;1;0;0;0;1;1;0;0;0;1;688;30;-27.012471;-48.6320716
Balneário Camboriú;4202008;CAIC AYRTON SENNA DA SILVA;42124530;1;0;1;0;0;0;1;0;0;0;0;0;1045;39;-27.0071309;-48.639887
Navegantes;4211306;ESC MUN PROFª ELSIR B GAYA MULLER;42124549;1;0;1;0;0;0;1;0;0;0;0;1;614;24;-26.8933598;-48.6513343
Florianópolis;4205407;NEIM ALTINO DEALTINO CABRAL;42124565;1;0;1;0;0;0;0;1;0;0;0;1;50;7;-27.5027715;-48.515575
Fraiburgo;4205506;CEM MACIEIRA;42124573;2;0;1;0;0;0;1;1;0;0;0;1;173;11;-27.079915;-50.89141667
Imbituba;4207304;ESC MUN PROFª HERMINIA DE S MARQUES;42124590;1;0;1;0;0;0;0;1;0;0;0;1;197;10;-28.15259667;-48.691285
Blumenau;4202404;CEI PROFª TEREZA A E AUGSBURGER;42124603;1;0;1;0;0;0;1;0;0;0;0;1;317;41;-26.8668961;-49.1213588
Blumenau;4202404;CEI PAULO ZIMMERMANN;42124611;1;0;1;0;0;0;1;0;0;0;0;1;195;20;-26.8488919;-49.0712257
Blumenau;4202404;EBMB PROF JOAO JOAQUIM FRONZA;42124620;1;0;1;0;0;0;1;0;0;0;0;1;585;33;-26.8591364;-49.1379849
Caxambu do Sul;4204103;ESC MUN BAIRRO ANTENA;42124646;1;0;1;0;0;0;0;0;1;0;0;1;276;19;-27.1626581;-52.8800542
Balneário Camboriú;4202008;N E I MEU PRIMEIRO PASSO;42124662;1;0;1;0;0;0;1;0;0;0;0;1;105;13;-26.97537;-48.64708
Balneário Camboriú;4202008;NEI SANTA CLARA;42124670;1;0;1;0;0;0;1;0;0;0;0;0;103;13;-27.00391762;-48.64003939
Balneário Camboriú;4202008;N E I BRILHO DO SOL;42124689;1;0;1;0;0;0;0;1;0;0;0;1;67;22;-27.03079991;-48.58444132
Lindóia do Sul;4209854;NUCLEO DE EDUC OTTAVIANO NICOLAO;42124697;1;0;1;0;0;0;1;0;0;0;0;1;260;15;-27.05248764;-52.09148394
Maravilha;4210506;CENTRO EDUCACIONAL MUNDO INFANTIL;42124700;1;0;1;0;0;0;0;1;0;0;0;1;752;53;-26.77488496;-53.1907764
Morro da Fumaça;4211207;EEBM BIAZIO MARAGNO;42124727;1;0;1;0;0;0;1;1;0;0;0;1;320;19;-28.5977293;-49.2471024
Palma Sola;4212007;CENTRO EDUCACIONAL FADA MADRINHA;42124743;1;0;1;0;0;0;0;1;0;0;0;1;120;12;-26.35043192;-53.28765539
Palma Sola;4212007;CRECHE CRIANCA FELIZ;42124751;1;0;1;0;0;0;0;1;0;0;0;0;84;10;-26.3526158;-53.2812317
Palma Sola;4212007;PE PINGO DE GENTE;42124760;1;0;1;0;0;0;0;1;0;0;0;1;62;9;-26.34368045;-53.2773457
Aurora;4201901;CENTRO EDUCACIONAL CAMINHO DOS SONHOS;42124786;1;0;1;0;0;0;1;0;0;0;1;0;164;24;-27.30419833;-49.63652
José Boiteux;4209151;ESCOLA ISOLADA MUNICIPAL JESUINO DIAS DE OLIVEIRA;42124794;2;1;1;0;0;0;0;1;0;0;0;1;4;1;;
Rio do Campo;4214508;CENTRO EDUCACIONAL FRITZ FALLER;42124808;2;0;1;0;0;0;1;0;0;0;0;1;101;4;-26.94351667;-50.14221167
Jaborá;4208609;ESCOLA BASICA MUNICIPAL ALBERTO BORDIN;42124840;1;0;1;0;0;0;0;1;0;0;0;1;419;22;-27.17041841;-51.74814636
Abdon Batista;4200051;CRECHE E PRE-ESCOLA DONA TEREZA;42124867;1;0;1;0;0;0;1;0;0;0;0;1;67;10;-27.6081698;-51.0260473
Vargem Bonita;4219176;CENTRO DE EDUCACAO INFANTIL PINGO DE OURO;42124875;1;0;1;0;0;0;1;0;0;0;0;0;62;8;-26.87122749;-51.79276468
Rancho Queimado;4214300;CENTRO DE EDUCACAO INFANTIL MARIAZINHA;42124913;1;0;1;0;0;0;0;1;0;0;0;1;49;6;-27.63948617;-49.10957445
Gaspar;4205902;CDI MARIA DA SILVA;42124921;1;0;1;0;0;0;0;1;0;0;0;1;354;14;-26.9147286;-48.9500439
Gaspar;4205902;CDI VOVO BENTA;42124930;1;0;1;0;0;0;0;1;0;0;0;1;168;12;-26.94512667;-48.98451
Braço do Norte;4202800;CEI VILA NOVA;42124980;1;0;1;0;0;0;1;0;0;0;0;1;86;5;-28.26500221;-49.17846847
Jaguaruna;4208807;PE MUNDO DA CRIANCA;42124999;2;0;1;0;0;0;0;0;1;0;0;0;28;3;-28.63779675;-49.01861144
São Ludgero;4217006;CENTRO DE EDUCACAO INFANTIL DIVINA PROVIDENCIA;42125022;1;0;1;0;0;0;1;0;0;0;0;0;126;12;-28.32889273;-49.15919339
Xaxim;4219705;ESCOLA MUNICIPAL PROFESSORA DIRCE SALETE DALL AGNOL;42125057;1;0;1;0;0;0;0;1;0;0;0;1;436;50;-26.9555626;-52.5407467
Bombinhas;4202453;EB MUN DONA DILMA MAFRA;42125103;1;0;1;0;0;0;1;0;0;0;0;1;370;21;;
Irineópolis;4207908;GRUPO ESCOLAR ZELIA MILLES;42125111;1;0;1;0;0;0;1;1;0;0;0;0;248;13;-26.24795245;-50.80025738
Rio Negrinho;4215000;CMEI VILA NOVA;42125146;1;0;1;0;0;0;1;0;0;0;0;1;130;18;-26.24913816;-49.51100981
Rio Negrinho;4215000;CMEI PEQUENO PRINCIPE;42125154;1;0;1;0;0;0;1;0;0;0;0;0;97;10;-26.23209252;-49.50511381
Rio Negrinho;4215000;CMEI SAO PEDRO;42125162;1;0;1;0;0;0;1;0;0;0;0;1;80;11;-26.26985918;-49.55327011
São Bento do Sul;4215802;EB MUN PROFESSOR NEWTON MENDES;42125170;1;0;1;0;0;0;1;0;0;0;0;1;203;13;-26.270452;-49.3698888
São Bento do Sul;4215802;CEI MUN AMOR PERFEITO;42125200;1;0;1;0;0;0;0;1;0;0;0;1;102;8;-26.2350614;-49.3718951
Catanduvas;4204004;EMEB PROFESSOR VITOLDO ALEXANDRE CZECH;42125227;1;0;1;0;0;0;1;0;0;0;0;1;217;18;-27.05656506;-51.65855427
Garuva;4205803;ESCOLA MUN VICENTE VIEIRA;42125243;1;0;1;0;0;0;1;0;0;0;0;1;1139;34;-26.0359;-48.85233
Joinville;4209102;ESCOLA MUNICIPAL DOUTOR SADALLA AMIN GHANEM;42125260;1;0;1;0;0;0;1;0;1;0;0;1;820;31;-26.36099;-48.81283
Joinville;4209102;ESCOLA MUNICIPAL ENFERMEIRA HILDA ANNA KRISCH;42125278;1;0;1;0;0;0;1;0;0;0;0;1;1185;46;-26.26047;-48.80427
Itaiópolis;4208104;UD DE ITAIOPOLIS;42125294;1;0;1;0;0;0;1;0;0;0;0;0;175;20;-26.33595089;-49.90465501
Mafra;4210100;CEJA DE MAFRA;42125308;1;0;1;0;0;0;1;0;0;0;0;0;192;27;-26.1148;-49.80558
Garuva;4205803;ESC MUN GUILHERME R E P BENKENDORF;42125340;1;0;1;0;0;0;1;1;0;0;0;0;192;7;;
Mafra;4210100;CEIM COMECINHO DE VIDA NATHAAN A RAMOS;42125359;1;0;1;0;0;0;0;1;0;0;0;1;365;26;-26.11730314;-49.81276341
São Francisco do Sul;4216206;CAIC IRMA JOAQUINA;42125367;1;0;1;0;0;0;0;1;0;0;0;1;511;29;-26.249155;-48.6300991
Garuva;4205803;ESC MUN MARIA MARTINS BUDAL;42125375;1;0;1;0;0;0;0;1;0;0;0;1;92;7;-26.02937;-48.8629
Joinville;4209102;ESCOLA MUNICIPAL PROFESSOR AVELINO MARCANTE;42125421;1;0;1;0;0;0;0;1;0;0;0;1;1007;39;-26.25171;-48.8423
Joinville;4209102;ESCOLA MUNICIPAL DR RUBEN ROBERTO SCHMIDLIN;42125430;1;0;1;0;0;0;1;0;0;0;0;1;1155;39;-26.32816;-48.90693
Joinville;4209102;ESCOLA ADVENTISTA JOINVILLE - COSTA E SILVA;42125448;1;0;1;0;0;0;1;0;0;0;0;1;410;25;-26.27127;-48.86792
Itajaí;4208203;CEI PROF DIVA VIEIRA ABRANTES;42125472;1;0;1;0;0;0;1;0;0;0;0;1;407;26;-26.8780423;-48.7503071
Nova Trento;4211504;ESCOLA MUNICIPAL DE EDUCACAO BASICA DE AGUTI;42125480;2;0;1;0;0;0;0;0;1;0;0;1;92;17;-27.31720925;-49.11821754
Concórdia;4204301;CENTRO EDUCACIONAL ARTEDUCACAO;42125499;1;0;1;0;0;0;1;0;0;0;0;0;9;2;-27.23559457;-52.03238697
Navegantes;4211306;CENTRO EDUCACIONAL SANTO ANJO;42125537;1;0;1;0;0;0;1;0;0;0;0;1;234;15;-26.90109;-48.6469
Balneário Piçarras;4212809;CENTRO INTEGRADO DE ENSINO FUNDAMENTAL PROFª MIRIAN GENY FRIEDRICHSEN;42125553;1;0;1;0;0;0;1;0;0;0;0;1;1138;62;-26.77338861;-48.66520509
Camboriú;4203204;CAIC JOVEM AILOR LOTERIO;42125588;1;0;1;0;0;0;1;0;0;0;0;1;2088;76;-27.0020695;-48.6655758
Ponte Alta;4213302;EEB MUN SAO FRANCISCO;42125596;1;0;1;0;0;0;1;0;0;0;0;1;277;13;-27.48452055;-50.37562497
Joaçaba;4209003;CEJA DE JOACABA;42125600;1;0;1;0;0;0;1;0;0;0;0;0;324;21;-27.17612;-51.50403
Três Barras;4218301;EBM FRANCISCO ROCHA;42125618;2;0;1;0;0;0;0;1;0;0;0;0;222;16;-26.16679;-50.16895
Balneário Gaivota;4202073;CEI PINGO DE GENTE;42125626;1;0;1;0;0;0;1;0;0;0;0;0;147;14;-29.13307519;-49.60532517
Barra Bonita;4202099;CENTRO DE EDUCACAO INFANTIL MUNICIPAL PINGO DE GENTE;42125685;2;0;1;0;0;0;0;1;0;0;0;1;50;8;-26.65424464;-53.43860589
São Miguel do Oeste;4217204;CEI SONHO INFANTIL;42125723;1;0;1;0;0;0;0;1;0;0;0;1;101;10;-26.7396471;-53.5259906
São Miguel do Oeste;4217204;EEB SAO JOAO BATISTA;42125731;1;0;1;0;0;0;1;0;0;0;0;0;377;30;-26.72582231;-53.53516066
Itapiranga;4208401;EMIR OSCAR PUHL;42125740;2;0;1;0;0;0;0;1;0;0;0;1;73;9;-27.18088;-53.64125
Itapiranga;4208401;ESCOLA MUNICIPAL DE EDUCACAO INFANTIL PINGUINHO DE GENTE;42125758;1;0;1;0;0;0;1;0;0;0;0;1;51;8;-27.16514;-53.71576
Rio do Sul;4214805;CEI CINDERELA;42125790;1;0;1;0;1;0;1;1;0;0;0;1;309;30;-27.22142526;-49.63336437
Tubarão;4218707;CEJA DE TUBARAO;42125871;1;0;1;0;0;0;1;0;0;0;0;1;285;30;-28.4839819;-49.0086766
Florianópolis;4205407;NEIM JOEL ROGERIO DE FREITAS;42125880;1;0;1;0;0;0;0;1;0;0;0;1;212;15;-27.5894631;-48.6000918
Florianópolis;4205407;COLEGIO E PRE VESTIBULAR SOLUCAO LTDA ME;42125901;1;0;1;0;0;0;1;0;0;0;0;0;238;20;;
Tubarão;4218707;EMEB SAO JUDAS TADEU;42125928;1;0;1;0;0;0;1;0;0;0;0;0;229;18;-28.4777334;-49.0193009
Chapecó;4204202;CEIM BB CRIANCA;42125936;1;0;1;0;0;0;0;0;1;0;0;1;379;22;-27.12259083;-52.61067755
Chapecó;4204202;CEIM AQUARELA;42125944;1;0;1;0;0;0;0;0;1;0;0;1;447;23;-27.08204933;-52.61918742
Braço do Norte;4202800;CENTRO EDUC ALPHA IDEAL;42125952;1;0;1;0;0;0;1;0;0;0;0;1;332;18;-28.27322294;-49.1698291
Braço do Norte;4202800;CEJA DE BRACO DO NORTE;42125979;1;0;1;0;0;0;1;0;0;0;0;0;212;20;-28.283005;-49.1640472
Jaguaruna;4208807;EB MUN PROFª DALCY AVILA DE SOUZA;42125987;1;0;1;0;0;0;0;1;0;0;0;0;756;45;-28.6247739;-49.0157535
Vargeão;4219101;ESC MUN FORTUNATO DANIELLI;42126061;1;0;1;0;0;0;0;1;0;0;0;1;353;20;-26.86384;-52.15285
Imbituba;4207304;COOPERATIVA EDUCACIONAL DE IMBITUBA;42126088;1;0;1;0;0;0;1;0;0;0;1;1;179;20;-28.23879;-48.66255
Imbituba;4207304;CMEI LAURA PERFEITO;42126096;1;0;1;0;0;0;1;0;1;0;0;1;176;25;-28.26706833;-48.69125
Videira;4219309;CENTRO MUNICIPAL DE EDUCACAO INFANTIL LUIZ ANTONIO FACCIO;42126118;1;0;1;0;0;0;0;1;0;0;0;0;187;12;-27.00505242;-51.18357269
Videira;4219309;CENTRO MUNICIPAL DE EDUCACAO INFANTIL VEREADOR JORGE MARTINS;42126126;1;0;1;0;0;0;0;1;0;0;0;0;225;13;-26.98826608;-51.17321962
Pinheiro Preto;4213005;CENTRO EDUCACIONAL PADRE TRUDO PLESSERS;42126142;1;0;1;0;0;0;1;0;0;0;0;0;102;13;-27.04428321;-51.23003265
Caçador;4203006;CEJA DE CACADOR;42126150;1;0;1;0;0;0;1;0;0;0;0;1;177;21;-26.7694983;-51.0194462
Blumenau;4202404;EBM WILHELM THEODOR SCHURMANN;42126177;1;0;1;0;0;0;1;0;0;0;0;1;718;49;-26.83456698;-49.08347254
Irani;4207809;UD DE IRANI;42126185;1;0;1;0;0;0;1;0;0;0;0;1;110;10;-27.0222864;-51.8919531
São Bento do Sul;4215802;CEJA DE SAO BENTO DO SUL;42126207;1;0;1;0;0;0;0;0;1;0;0;0;60;15;-26.24817;-49.45615
São Lourenço do Oeste;4216909;CEJA DE SAO LOURENCO DO OESTE;42126223;1;0;1;0;0;0;0;1;0;0;0;1;159;21;-26.35972032;-52.85286594
Benedito Novo;4202206;CEI PROFESSORA MARINA ALVES MAUS;42126231;1;0;1;0;0;0;1;0;0;0;0;1;96;8;-26.76394833;-49.36019167
Benedito Novo;4202206;CRECHE MUN VER ANTONIO MAURICIO STOLFI;42126240;1;0;1;0;0;0;1;1;0;0;0;1;172;8;-26.77881;-49.41065333
Içara;4207007;CEI APRENDENDO BRINCANDO;42126258;1;0;1;0;0;0;0;1;0;0;0;0;65;6;-28.6893799;-49.3179771
Porto Belo;4213500;NDI MUN PRIMEIROS PASSOS;42126266;1;0;1;0;0;0;1;0;0;0;0;1;293;20;-27.1540943;-48.5917279
Criciúma;4204608;ESCOLA DE SAUDE SAO JOSE;42126282;1;0;1;0;0;0;1;0;0;0;0;1;177;16;-28.67347889;-49.36347152
Araranguá;4201406;CEJA DE ARARANGUA;42126304;1;0;1;0;0;0;1;0;0;0;0;0;143;15;-28.9247107;-49.4798306
Florianópolis;4205407;UD COMPLEXO PENITENCIARIO DE FLORIANOPOLIS;42126320;1;0;1;0;0;0;1;0;0;0;0;0;183;22;-27.57873532;-48.52630103
Laurentino;4209508;UD DE LAURENTINO;42126339;1;0;1;0;0;0;1;0;0;0;0;0;45;4;-27.2232731;-49.7337192
Correia Pinto;4204558;ESCOLA MULT MUN BARRA DOS INDIOS;42126347;2;0;1;0;0;0;0;1;0;0;1;1;11;1;;
Urubici;4218905;CEI BERNADETE BACK WARMLING;42126380;2;0;1;0;0;0;0;1;0;0;0;1;67;4;-28.02314688;-49.49989278
Navegantes;4211306;UD DE NAVEGANTES;42126398;1;0;1;0;0;0;1;0;0;0;0;1;182;18;-26.88883;-48.65977
Itapiranga;4208401;CEJA DE ITAPIRANGA;42126410;1;0;1;0;0;0;1;0;0;0;0;1;46;9;-27.1717016;-53.7124293
Canoinhas;4203808;CEJA DE CANOINHAS;42126452;1;0;1;0;0;0;1;1;0;0;0;1;119;15;-26.1824498;-50.3894532
Praia Grande;4213807;UD DE PRAIA GRANDE;42126487;1;0;1;0;0;0;1;0;0;0;0;0;38;4;-29.18752839;-49.94686603
Florianópolis;4205407;CEPU CENTRO DE ESTUDOS PRE UNIVERSITARIO;42126495;1;0;1;0;0;0;1;0;0;0;0;0;110;4;;
Florianópolis;4205407;CEJA DE FLORIANOPOLIS;42126509;1;0;1;0;0;0;1;0;0;0;0;0;819;101;-27.59769487;-48.54658228
Concórdia;4204301;CEJA DE CONCORDIA;42126517;1;0;1;0;0;0;1;0;0;0;0;1;302;29;-27.23403503;-52.02319278
Criciúma;4204608;CEJA DE CRICIUMA;42126525;1;0;1;0;0;0;1;0;0;0;0;0;242;26;-28.6908728;-49.38837399
Cocal do Sul;4204251;COLEGIO COCAL;42126533;1;0;1;0;0;0;1;0;0;0;0;1;127;16;-28.6031694;-49.3303144
Ituporanga;4208500;CEJA DE ITUPORANGA;42126550;1;0;1;0;0;0;0;1;0;0;0;1;259;25;-27.4082102;-49.6056364
Imbuia;4207403;UD DE IMBUIA;42126568;1;0;1;0;0;0;1;0;0;0;0;1;50;9;-27.4937033;-49.4235904
Balneário Camboriú;4202008;CEJA DEPUTADO DOUTEL DE ANDRADE;42126584;1;0;1;0;0;0;1;0;0;0;0;1;354;21;-27.002469;-48.6314875
Camboriú;4203204;UD DE CAMBORIU;42126606;1;0;1;0;0;0;1;0;0;0;0;0;101;17;-27.0370086;-48.6470642
Luiz Alves;4210001;UD DE LUIZ ALVES;42126614;1;0;1;0;0;0;1;0;0;0;0;0;76;7;-26.7250179;-48.930966
Itajaí;4208203;CEJA DE ITAJAI;42126622;1;0;1;0;0;0;1;0;0;0;0;1;269;32;-26.9158398;-48.6659089
Ilhota;4207106;UD DE ILHOTA;42126630;1;0;1;0;0;0;1;0;0;0;0;0;38;7;-26.9042218;-48.8301876
Rio do Sul;4214805;SENAC;42126649;1;0;1;0;0;0;1;0;0;0;0;1;148;13;-27.2134377;-49.631663
Lages;4209300;CEJA DE LAGES;42126657;1;0;1;0;0;0;1;0;0;0;0;1;794;52;-27.81241809;-50.32518662
